date,title,currency
2025-01-15,"No, Ethereum (ETH) Is Not Dead, Says Top Analyst",Ethereum
2025-01-15,Gate Technology Ltd Rebrands to Gate.io in Europe,Ethereum
2025-01-15,Nebula Stride Announces Major Developments as NST Presale Gains Traction,Ethereum
2025-01-15,Ripple v. SEC: How Will New Developments Affect XRP Price?,Ethereum
2025-01-15,Stellar Lumen (XLM) Price Prediction 2025,Ethereum
2025-01-15,What is DeSci: Guide on Decentralized Science in Crypto,Ethereum
2025-01-15,Top 10 Crypto Media Outlets Enter 2025: Latest Similarweb Data Update,Ethereum
2025-01-15,Solana (SOL) Price Prediction for March 26,Solana
2025-01-15,"Solpot Emerges as Solana's Premier On-Chain Platform, Distributes Over $400K in Free Rewards",Solana
2025-01-15,Breaking: Fidelity Officially Joins Solana ETF Race,Solana
2025-01-15,BlackRock Expands Blockchain Footprint to Solana,Solana
2025-01-15,Solana Dog-Coin BONK Rallies 35% Unnoticed – What's Behind It?,Solana
2025-01-15,Whale.io to Bridge NFT Collection from TON Blockchain to Solana,Solana
2025-01-15," Solana Co-Founder Trashes L2s, Says L1s Are Faster and More Secure",Solana
2025-01-15,Solana (SOL) Price Prediction for March 23,Solana
2025-01-15,Justin Sun Sparks Tron ETF Rumors as TRX Expands to Solana,Solana
2025-01-15,"Bitcoin (BTC): Make or Break Support Reached, Dogecoin (DOGE) Price at Breaking Point, Secret Bullish Solana (SOL) Pattern Formed?",Solana
2025-01-15,Did CME's Solana Futures Flop? Not Really,Solana
2025-01-15,TokenFi Removes TOKEN Buy/Sell Tax After Unanimous DAO Vote,Ethereum
2025-01-15,Solana at $127: What to Expect From SOL Price This Week,Solana
2025-01-15,The Nation Token ($NATO) Officially Launches Following Historic Airdrop to 1 Million Users on Base,Ethereum
2025-01-15,"XRP Plummets Below $2, Bitcoin (BTC) Ends Weakest Bull Market Since Creation, Ethereum (ETH) Holding onto Dear $2,000",Ethereum
2025-01-15,"Solana (SOL) Death Cross Incoming, Dogecoin (DOGE) Hits Last Possible Support, Ethereum (ETH) Says Goodbye to $2,000 ",Ethereum
2025-01-15,Fidelity Files for Staking on Ethereum ETF Product,Ethereum
2025-01-15,"Ethereum Foundation Makes 30,098 ETH Liquidation Play on Maker: Details",Ethereum
2025-01-15,Ethereum (ETH) Price Prediction for March 11,Ethereum
2025-01-15,Tron Founder Justin Sun Issues Crucial Ethereum Warning: Details,Ethereum
2025-01-15,Ethereum (ETH) Price Prediction for March 10,Ethereum
2025-01-15,Consensys CEO Says Ethereum Must Remain Neutral ,Ethereum
2025-01-15,"Ethereum (ETH): $2,000 Might Be Lost Today",Ethereum
2025-01-15,Ethereum (ETH) Price Prediction for March 7,Ethereum
2025-01-15,"XRP's $2.50 Price Breakout Still Questionable, Dogecoin (DOGE) Hits Major Support Again, Ethereum (ETH) Not Okay",Ethereum
2025-01-15,Ethereum (ETH) Price Prediction for March 5,Ethereum
2025-01-15,"XRP: 24% Retrace is Mind-Blowing, Ethereum (ETH) Looks Even Worse Than Before, Cardano (ADA): Biggest Volatility Surge in Years ",Ethereum
2025-01-15,Solana Flips Ethereum Again as DEX Volume Hits $3.99 Billion,Ethereum
2025-01-15,"Ethereum to $6,000? Peter Brandt Highlights Key Chart Pattern",Ethereum
2025-01-15,"XRP Needs This Breakthrough for Price Skyrocketing, Shiba Inu (SHIB) Won't Join Market Recovery? Ethereum (ETH) Needs 26% to Make It All Back",Ethereum
2025-01-15,Ethereum (ETH) Price Prediction for March 2,Ethereum
2025-01-15,Beiko Comments on 'Turning Point' in Ethereum History,Ethereum
2025-01-15,Ethereum (ETH) Price Prediction for February 27,Ethereum
2025-01-15,Ethereum ETFs Log Nearly $22 Million Worth of Outflows,Ethereum
2025-01-15,$59 Million Solana (SOL) in 7 Days: What's Going to Happen?,Solana
2025-01-15,Solana (SOL) Celebrates 5th Birthday: Details,Solana
2025-01-15,Top Satoshi Candidate Says XRP and Solana Parts of Reserve Are ‘Obvious Scams’,Solana
2025-01-15,"Dogecoin, Solana, XRP: Up to 20% Tumbling, What's Happening?",Solana
2025-01-15,"Is Bitcoin (BTC) Ready for $100,000? Solana (SOL) Skyrockets, But in Wrong Way, Shiba Inu (SHIB): Is There Any Hope? ",Solana
2025-01-15,Solana Flips Ethereum Again as DEX Volume Hits $3.99 Billion,Solana
2025-01-15,Solana (SOL) Price Prediction for March 3,Solana
2025-01-15,"Solana Price Rebounds 10%, Here's Impact on SOL Liquidations",Solana
2025-01-15,Solana (SOL) Futures Launch Date Confirmed by CME Group: Details,Solana
2025-01-15,"96,180 Solana (SOL) Exit Binance, Staked by Whale",Solana
2025-01-15,"3 Major Dogecoin (DOGE) Support Levels, Shiba Inu (SHIB) Attempts Solid Recovery, Solana (SOL) Sees Secret Whale Accumulation",Solana
2025-01-15,"Bitcoin (BTC) on Yearly Low, Shiba Inu (SHIB) Plummeting Aggravated, Solana (SOL) Far Too Close to $100",Solana
2025-01-15,Solana (SOL) Lost 45%: Bitcoin Domination Isn't Stopping?,Solana
2025-01-15,"Shiba Inu (SHIB) Breaks Crucial Resistance, Solana (SOL) Plummeting Finally Stops, Ethereum (ETH) Price Grows, Damage Negated?",Solana
2025-01-15,Solana (SOL) Price Prediction for February 22,Solana
2025-01-15,Franklin Templeton Files for Solana ETF: Details,Solana
2025-01-15,Nebula Stride Announces Major Developments as NST Presale Gains Traction,Solana
2025-01-15,Ripple v. SEC: How Will New Developments Affect XRP Price?,Solana
2025-01-15,Stellar Lumen (XLM) Price Prediction 2025,Solana
2025-01-15,Solana (SOL) Whales Capitulate? Here's How Much Will Be Sold,Solana
2025-01-15,"Bitcoin (BTC) Must Break This to Reach $100,000, Dogecoin (DOGE) Coming Closer to Bull Market, Solana (SOL) Death Cross Complications",Solana
2025-01-15,Solana's Growth Falls by 88% ,Solana
2025-01-15,Solana (SOL) Founder Presents 3 Major Scenarios for US Strategic Reserve,Solana
2025-01-15,Solana vs. Ethereum: Eight Parameters Compared by Crypto Expert,Solana
2025-01-15,Solana (SOL) Price Prediction for March 14,Solana
2025-01-15,"Solana's (SOL) Legendary Cup and Handle Pattern Shaping Up, Here's Target",Solana
2025-01-15,"Dogecoin Death Cross Confirmed, Solana (SOL): Joins DOGE With Its Own Death Cross, XRP Recovery Continues: Next Level to Watch",Solana
2025-01-15,"201,755 Solana (SOL) Stun World's Largest Crypto Exchange",Solana
2025-01-15,Solana ETF Proposed by $1.5 Trillion Investment Titan ,Solana
2025-01-15,Solana (SOL) Revenue Falls 93% From January High,Solana
2025-01-15,Solana (SOL) Price Prediction for March 12,Solana
2025-01-15,"Solana (SOL) Death Cross Incoming, Dogecoin (DOGE) Hits Last Possible Support, Ethereum (ETH) Says Goodbye to $2,000 ",Solana
2025-01-15,"Solana (SOL) Reclaims $123, Is Sell-off Over?",Solana
2025-01-15,Solana (SOL) on Verge of Death Cross Amid Market Sell-off: Potential Scenarios,Solana
2025-01-15,"XRP: Movement to Death Cross Begins, Shiba Inu (SHIB) Bulls Gave Up? Solana (SOL) Bullish Reversal Might Be Around Corner",Solana
2025-01-15,Solana (SOL) Price Prediction for March 8,Solana
2025-01-15,"$5.18 Billion Solana (SOL) Stun Market Bulls, Here's Why",Solana
2025-01-15,"Peter Schiff Creates His Own BTC Reserve, Receives Solana Instead",Solana
2025-01-15,"Bitcoin (BTC) $100,000 Momentum Gone, Solana (SOL): Surprising Move Incoming? Shiba Inu (SHIB) Heating up for Skyrocketing?",Solana
2025-01-15,"BlackRock's IBIT Makes First BTC Purchase in 7 Days, Solana Founder Presents 3 Major Scenarios for US Strategic Reserve, Texas Senate Passes Bitcoin Reserve Bill: Crypto News Digest by U.Today",Solana
2025-01-15,"Shiba Inu (SHIB) Delivers Grim Volume Signal, Bitcoin (BTC): Is it Trying to Break $90,000? Solana (SOL): Days Before Recovery?",Solana
2025-01-15,"Ethereum Risks Drop to $1,400, Mirroring 2020 Crash, Crypto Trader Warns",Ethereum
2025-01-15,Top 10 Crypto Media Outlets Enter 2025: Latest Similarweb Data Update,Solana
2025-01-15,XRP vs. Ethereum (ETH): Ripple CTO Clears up Major Sale Misconception,Ethereum
2025-01-15,What is DeSci: Guide on Decentralized Science in Crypto,Solana
2025-01-15,Top 10 Crypto Media Outlets Enter 2025: Latest Similarweb Data Update,Bitcoin
2025-01-15,"'Is $1,000 Next?': Bloomberg's McGlone Queries Latest Ethereum Sell-Off",Ethereum
2025-01-15,Ethereum Crashes 74% Against Bitcoin; Is Reversal Imminent?,Ethereum
2025-01-15,"Shiba Inu (SHIB): Bulls in Control Now? Bitcoin (BTC) in Great Spot, Ethereum (ETH): Major Bearish Signal, But There's Silver Lining ",Ethereum
2025-01-15,"BlockDAG (BDAG) Pre-Sale Hits Beta Testnet Launch as Ethereum (ETH), Shiba Inu (SHIB) Struggling with Pressure",Ethereum
2025-01-15,"10.84 Million Ethereum (ETH) in 24 Hours, What Are Bulls up To?",Ethereum
2025-01-15,"Is XRP Price Ready for $3? Ethereum (ETH) Seeing $2,000 Test, Shiba Inu (SHIB) 1.5 Trillion Whale Pump Recorded",Ethereum
2025-01-15,Ethereum Adoption Grows With Launch of Bank-Issued Stablecoin,Ethereum
2025-01-15,Ethereum (ETH) Price Prediction for March 24,Ethereum
2025-01-15,"Bitcoin (BTC) Invalidates Crucial Price Setup, XRP Faces 50 and 100 Day Squeeze, Ethereum (ETH) Finally Bounces Back?",Ethereum
2025-01-15,Ethereum (ETH) Fees Plummet 50% as Network Activity Slowdown Sparks Concerns,Ethereum
2025-01-15,"New Key Date for XRP Holders Just Emerged, Major Exchange Lists ADA and Coinbase Ethereum for Futures Collateral, Billions of SHIB Purchased by Major Dormant ETH Whale: Crypto News Digest by U.Today",Ethereum
2025-01-15,"Is $3 XRP Possible? Bitcoin (BTC) Makes Biggest Breakout in 2025, Ethereum (ETH) Finally Above $2,000",Ethereum
2025-01-15,Ethereum (ETH) Price Prediction for March 22,Ethereum
2025-01-15,Billions of Shiba Inu (SHIB) Acquired by Major Dormant Ethereum Whale,Ethereum
2025-01-15,"XRP Flips Ethereum in Fully Diluted Valuation, Here's Implication",Ethereum
2025-01-15,"XRP Already Recovered 20%, Enormous Ethereum (ETH) Selling Volume Before $2,000, Sixth Shiba Inu (SHIB) Recovery Attempt: Another Crash?",Ethereum
2025-01-15,Solana vs. Ethereum: Eight Parameters Compared by Crypto Expert,Ethereum
2025-01-15,New Ethereum ETF Staking Proposal Filed by NYSE ,Ethereum
2025-01-15,Standard Chartered Dramatically Reduces Ethereum (ETH) Price Target ,Ethereum
2025-01-15,"Shiba Inu (SHIB) Reaches Crucial Price Test, Ethereum (ETH) Eyeing $2,000 Again, Can XRP Avoid This Grim Movement?",Ethereum
2025-01-15,Ethereum (ETH) Price Prediction for March 17,Ethereum
2025-01-15,Ethereum ETFs Hemorrhage $50 Million ,Ethereum
2025-01-15,Consensus 2025,Ethereum
2025-01-15,Ethereum (ETH) Price Prediction for March 19,Ethereum
2025-01-15,"BlockDAG (BDAG) Enters New Roadmap Phase as Shiba Inu (SHIB), Ethereum (ETH) Price Metrics Consolidate",Ethereum
2025-01-15,Major Exchange Lists Cardano (ADA) and Coinbase Ethereum for Futures Collateral,Ethereum
2025-01-15,Ethereum (ETH) Developers Launch Hoodi Testnet and Prepare Pectra for Mainnet Launch in May,Ethereum
2025-01-16,What is DeSci: Guide on Decentralized Science in Crypto,Bitcoin
2025-01-18,Stellar Lumen (XLM) Price Prediction 2025,Bitcoin
2025-02-02,Ripple v. SEC: How Will New Developments Affect XRP Price?,Bitcoin
2025-03-14,Nebula Stride Announces Major Developments as NST Presale Gains Traction,Bitcoin
2025-03-24,Here’s Why Bitcoin Is Likely Never Dropping Below $45K,Bitcoin
2025-03-24,Bitcoin to $250K? Arthur Hayes Makes Bold BTC Price Prediction,Bitcoin
2025-03-24,Top Bitcoin Critic Reveals 'Only Scenario' Where Crypto Doesn't Crash,Bitcoin
2025-03-24,1 Million Bitcoin Prediction Made by Max Keiser,Bitcoin
2025-03-24,"Bitcoin (BTC) Market Alert Issued as Price Crosses $88,000: Details",Bitcoin
2025-03-24,"Bitcoin Faces ‘Great Reset’ Risk, Mike McGlone Warns",Bitcoin
2025-03-24,Bitcoin to $200K? ‘Rich Dad Poor Dad Author’ Says Many People Will Make This Mistake,Bitcoin
2025-03-24,Bitcoin (BTC) Price Prediction for March 24,Bitcoin
2025-03-24,Two World-Leading Exchanges Stunned by Massive Bitcoin Outflows,Bitcoin
2025-03-24,Breaking: Strategy Reaches Major Milestone with Most Recent Bitcoin Purchase,Bitcoin
2025-03-25,Breaking: GameStop Adopts Bitcoin as Reserve Asset,Bitcoin
2025-03-25,Fidelity's Timmer Says Bitcoin's Wallet Count Shows Little Growth ,Bitcoin
2025-03-25,Bitcoin (BTC) Breakout? Bollinger Bands Hint at Big Upside,Bitcoin
2025-03-25,"XRP Hits Bullish Reversal, Bitcoin Faces 'Great Reset' Risk, Mike McGlone Warns; Second Biggest SHIB Wallet Sees Mysterious Transfers: Crypto News Digest by U.Today",Bitcoin
2025-03-25,Strategy Copycat Expands Its Bitcoin Holdings,Bitcoin
2025-03-25,Bitcoin (BTC) Price Prediction for March 25,Bitcoin
2025-03-25,"Bitcoin (BTC) Poised for Golden Bull Run in April With 34% Surge, Price History Predicts",Bitcoin
2025-03-25,"Michael Saylor Stuns With Cryptic Bitcoin Tweet As BTC Eyes $88,000",Bitcoin
2025-03-25,BlackRock’s Bitcoin ETP Launches in Europe: Details,Bitcoin
2025-03-25, Fidelity Exec Names Key Reason Behind Bitcoin Price Correction,Bitcoin
2025-03-25,Bitcoin Price Plunges as Mt. Gox Makes Gargantuan Transfer,Bitcoin
2025-03-25,"Shiba Inu (SHIB): Lift off Beginning? XRP Performs Top-Tier Breakthrough, Bitcoin (BTC): $90,000 Next ",Bitcoin
2025-03-25,Key Bitcoin Demand Catalysts Uncovered by Peter Schiff: Details,Bitcoin
2025-03-26,Breaking: GameStop Raising $1.3 Billion to Buy Bitcoin,Bitcoin
2025-03-26,Bitcoin Whales With 10K BTC Holdings Increase — Supply Squeeze Incoming?,Bitcoin
2025-03-26,Bitcoin Not in 'Overheated Zone' Yet: CryptoQuant,Bitcoin
2025-03-26,'We Are All Satoshi': USDT Founder Reacts to News About Bitcoin Creator,Bitcoin
2025-03-26,Bitcoin up 700% Since Michael Saylor's Strategy's First BTC Buy,Bitcoin
2025-03-26,Bitcoin (BTC) Invalidates Death Cross: What's Next?,Bitcoin
2025-03-26,"Mysterious $262,759,132 Bitcoin Transfer Stuns Major US Exchange",Bitcoin
2025-03-26,Legendary Angel Investor Mocks GameStop's Bitcoin Pivot,Bitcoin
2025-03-26,"Bitcoin (BTC) Mini-Death Cross Originates, Key XRP Breakthrough Turns to be Fakeout? Dogecoin (DOGE) Only Top Asset Didn't Do It",Bitcoin
2025-03-26,Strategy's Saylor Challenges GameStop to Go Big on Bitcoin ,Bitcoin
2025-03-27,US Government Moving Millions of Dollars Worth of Bitcoin,Bitcoin
2025-03-27,GameStop Shares Getting Annihilated Following Bitcoin Pivot,Bitcoin
2025-03-27,"Buying Bitcoin 'Not Viable Long-Term Business Model', Says Peter Schiff",Bitcoin
2025-03-27,XRP vs. Bitcoin (BTC): 3 Big Scenarios From Bollinger Bands,Bitcoin
2025-03-27,"Billionaire Cliff Asness: ""I'm Not a Bitcoin Fan'",Bitcoin
2025-03-27,Strategy's Saylor Joins Gihbli Trend With Bullish Bitcoin Post,Bitcoin
2025-03-27,Peter Schiff Reacts to Bitcoin's Drop as Gold Sets Fresh Record High,Bitcoin
2025-03-28,"Shiba Inu (SHIB): Bulls in Control Now? Bitcoin (BTC) in Great Spot, Ethereum (ETH): Major Bearish Signal, But There's Silver Lining ",Bitcoin
2025-03-28,'Rich Dad Poor Dad' Author Predicts New ATH for Second Best Asset to Bitcoin,Bitcoin
2025-03-28,"Bitcoin (BTC) Faces Brutal Drop, Confirms Legendary Trader Peter Brandt",Bitcoin
2025-03-28,Bitcoin (BTC) Major Core Update: Key Changes Revealed,Bitcoin
2025-03-28,Breaking: Tether Mints 1 Billion USDT Tokens as Bitcoin Plunges Below $85K,Bitcoin
2025-03-28,Bitcoin (BTC) Price Prediction for March 28,Bitcoin
2025-03-28,Schiff: Bitcoin (BTC) to Collapse to $10K,Bitcoin
2025-03-28,Ethereum Crashes 74% Against Bitcoin; Is Reversal Imminent?,Bitcoin
2025-03-28,Bitcoin (BTC) Loses Crucial 200-Day Moving Average Amid Inflation Report,Bitcoin
2025-03-28,"$1.5 Billion: BlackRock Celebrates New Crypto Milestone, And It's Not Bitcoin",Bitcoin
